{
  "artifacts": {
    "prometheus": "suite.prom",
    "summary": "summary.json"
  },
  "generated_at": "2000-01-01T00:01:00Z",
  "kind": "suite",
  "policies": {
    "threshold": "fail",
    "unavailable": "fail"
  },
  "provenance": {
    "ci_authoritative": true,
    "mode": "runner"
  },
  "reason": "VALIDATION_RUN_ID is stale",
  "run_id": "fixture-stale-001",
  "run_issued_at": "2000-01-01T00:00:00Z",
  "schema_version": "1.0",
  "suite": "rocev2-pairwise",
  "verdict": "FAIL"
}
